Website,Company Name,Full Address,Postcode,Phone,Registration Number,Career Page URL,Linkedin URL
http://www.benders.co.uk/,Benders Limited,"59-60 The Market Square, London, England, N9 0TZ",", N9 0TZ",, 10600688 ,https://www.benders.co.uk/careers/,https://www.linkedin.com/company/benders-paper-cups
http://www.boldgate.co.uk,Boldgate Commercial Services Limited,"Unit 12 Brook Business Centre, Cowley Mill Road, Cowley, Uxbridge, Middlesex, UB8 2FX", UB8 2FX,+44 1895 236666, 05992448 ,http://www.boldgate.co.uk/recruit.html,https://www.linkedin.com/company/boldgate-commercial-services-limited
http://www.caterkwik.co.uk,Caterkwik,"The Lakeland Catering Centre, Newlands, Ulverston, Cumbria, LA12 7QQ",LA12 7QQ,+44 1229 480001, 04432906 ,http://www.caterkwik.co.uk//careers.shtml,https://www.linkedin.com/company/caterkwik
http://www.caterlinkuk.co.uk/,Caterlink UK Ltd,"Unit 3 Haywards Industrial Park, Northgate Way, Aldridge, Walsall, WS9 8SR", WS9 8SR,+44 1922 453168, 04688681 ,https://www.caterlinkuk.co.uk/job-vacancies/,https://www.linkedin.com/company/cater-link-limited
http://www.cedfabsltd.co.uk,CED Fabrications Ltd,"Unit A1 - A4 Falcon Court, Petre Road Clayton Le Moors, Accrington, Lancashire, BB5 5JD", BB5 5JD,+44 1254 238282, 02601496 ,http://www.cedfabsltd.co.uk/jobs-2018/,https://www.linkedin.com/company/ced-fabrications-ltd
